{
    "type": "DataSink",
    "name": "GenericLinePlot",
    "label": "Line Plot",
    "description": "Generic simple Line chart plot",
    "license": "cc by-nc-nd 4.0",
    "version": "1.0.2",
    "dockerImage": "192.168.219.5:8098/enbic2lab/misc/generic_lineplot:1.0.2",
    "tags": ["enbic2lab-misc", "cc by-nc-nd 4.0", "by-nc-nd", "Sink", "generic"],
    "parameters": [
      {
        "name": "--filepath",
        "label": "Filepath",
        "description": "Path to the CSV file",
        "defaultValue": "{{.inputs.input.path}}",
        "readOnly": true,
        "type": "string"
      },
      {
        "name": "--x-column",
        "label": "Column for X axis",
        "description": "Column name for the X axis",
        "type": "string"
      },
      {
        "name": "--y-column",
        "label": "Column for Y axis",
        "description": "Column name for the Y axis",
        "type": "string"
      },
      {
        "name": "--hue",
        "label": "Hue",
        "description": "Column name for the hue",
        "defaultValue": null,
        "type": "string"
      },
      {
        "name": "--palette",
        "label": "Palette",
        "description": "Color palette",
        "defaultValue": null,
        "type": "string"
      },
      {
        "name": "--style",
        "label": "Style column",
        "description": "Style column for the plot",
        "defaultValue": null,
        "type": "string"
      },
      {
        "name": "--markers",
        "label": "Markers on style",
        "description": "Change markers for the style",
        "defaultValue": "False",
        "type": "string"
      },
      {
        "name": "--dashes",
        "label": "Dashes on style",
        "description": "Change dashes for the style",
        "defaultValue": "False",
        "type": "string"
      },
      {
        "name": "--grid",
        "label": "Show grid",
        "description": "Show grid for the plot",
        "defaultValue": "True",
        "type": "string"
      },
      {
        "name": "--ci",
        "label": "Show confidence interval [95%]",
        "description": "Show confidence interval for the plot",
        "defaultValue": "True",
        "type": "string"
      },
      {
        "name": "--legend",
        "label": "Show legend",
        "description": "Show legend for the plot",
        "defaultValue": "True",
        "type": "string"
      },
      {
        "name": "--title",
        "label": "Title",
        "description": "Title of the plot",
        "defaultValue": null,
        "type": "string"
      },
      {
        "name": "--x-label",
        "label": "X axis label",
        "description": "Label of the X axis",
        "defaultValue": null,
        "type": "string"
      },
      {
        "name": "--y-label",
        "label": "Y axis label",
        "description": "Label of the Y axis",
        "defaultValue": null,
        "type": "string"
      },
      {
        "name": "--delimiter",
        "label": "Delimiter",
        "description": "Delimiter of the csv file",
        "defaultValue": ",",
        "type": "string"
      },
      {
        "name": "--output-path",
        "readOnly": true,
        "label": "Output path",
        "description": "Path to the output files",
        "defaultValue": "/mnt/shared",
        "type": "string"
      }
    ],
    "inputs": [
      {
        "name": "input",
        "type": "tabulardataset",
        "label": "Input CSV file",
        "path": "/mnt/shared/input.csv"
      }
    ],
    "outputs": [
      {
        "name": "output-pdf",
        "type": "pdf",
        "label": "Output PDF file",
        "path": "/mnt/shared/lineplot.pdf"
      },
      {
        "name": "output-png",
        "type": "image",
        "label": "Output PNG image",
        "path": "/mnt/shared/lineplot.png"
      },
      {
        "name": "output-svg",
        "type": "image",
        "label": "Output SVG image",
        "path": "/mnt/shared/lineplot.svg"
      }
    ],
    "mainScriptPath": "main.py",
    "testPath": "test_main.py",
    "dependencies": [
      {
        "name": "python",
        "version": "3.11.5",
        "license": "PSF",
        "url": "https://www.python.org/"
      }
    ],
    "resources": {
      "cores": 1,
      "memory": 128,
      "gpuNeeded": false,
      "gpuMemory": null,
      "estimatedTimeInMin": 1
    },
    "publicationDate": "2023-11-23T14:30:00.000Z",
    "author": {
      "email": "khaos.research@gmail.com",
      "affiliation": "Khaos Research Group"
    },
    "contributor": [
      {
        "email": "juancaruru@uma.es",
        "affiliation": "Khaos Research Group"
      },
      {
        "email": "dandobjim@uma.es"
      }
    ]
  }