{
  "type": "DataSink",
  "name": "analyse-trend",
  "label": "Analyse Trend",
  "description": "Perform Analyse Trend over pollen data",
  "license": "cc by-nc-nd 4.0",
  "version": "1.0.0",
  "dockerImage": "192.168.219.5:8098/enbic2lab/air/analyse_trend:1.0.0",
  "tags": [
    "enbic2lab-air",
    "cc by-nc-nd 4.0", "by-nc-nd",
    "analyse-trend"
  ],
  "parameters": [
    {
      "name": "--filepath",
      "label": "Input Filepath",
      "description": "Input file path",
      "type": "string",
      "defaultValue": "{{.inputs.input.path}}",
      "readOnly": true
    },
    {
      "name": "--interpolation",
      "label": "Apply Interpolation",
      "description": "Apply interpolation to fill gaps in data",
      "type": "string",
      "defaultValue": "true"
    },
    {
      "name": "--intMethod",
      "label": "Interpolation Method",
      "description": "Interpolation method (options: lineal, movingmean, tseries or spline)",
      "type": "string",
      "defaultValue": "lineal"
    },
    {
      "name": "--method",
      "label": "Pollen Season Calculation Method",
      "description": "Method for calculating pollen season (options: percentage, logistic, moving, clinical or grains)",
      "type": "string",
      "defaultValue": "percentage"
    },
    {
      "name": "--quantil",
      "label": "Quantile",
      "description": "Quantile of data to display (between 0 and 1)",
      "type": "number",
      "defaultValue": 0.75
    },
    {
      "name": "--significant",
      "label": "Significance Level",
      "description": "Significance level for linear trends analysis",
      "type": "number",
      "defaultValue": 0.05
    },
    {
      "name": "--split",
      "label": "Split Plot",
      "description": "Split the plot based on variable nature",
      "type": "string",
      "defaultValue": "true"
    },
    {
      "name": "--delimiter",
      "label": "Dataframe Delimiter",
      "description": "Dataframe delimiter",
      "type": "string",
      "defaultValue": ","
    },
    {
      "name": "--output-folder",
      "label": "Output directory",
      "description": "Path to the output directory",
      "defaultValue": "/mnt/shared/",
      "readOnly": true,
      "type": "string"
    }
  ],
  "inputs": [
    {
      "name": "input",
      "label": "Input CSV file",
      "path": "/mnt/shared/input.csv",
      "type": "tabulardataset"
    }
  ],
  "outputs": [
    {
      "name": "output pdf",
      "label": "Output PDF file",
      "path": "/mnt/shared/output.pdf",
      "type": "pdf"
    },
    {
      "name": "output xlsx",
      "label": "Output XLSX file",
      "path": "/mnt/shared/output.xlsx",
      "type": "xlsx"
    }
  ],
  "mainScriptPath": "main.R",
  "testPath": "test_main.R",
  "dependencies": [
    {
      "name": "r",
      "version": "4.3.1",
      "license": "PSF",
      "url": "https://www.r-project.org/"
    }
  ],
  "resources": {
    "cores": 1,
    "memory": 128,
    "gpuNeeded": false,
    "gpuMemory": null,
    "estimatedTimeInMin": 4
  },
  "publicationDate": "2023-11-03T10:00:00.000Z",
  "author": {
    "email": "khaos.research@gmail.com",
    "affiliation": "Khaos Research Group"
  },
  "contributor": [
    {
      "email": "adrianseor.99@uma.es",
      "affiliation": "Khaos Research Group"
    }
  ]
}