{
    "type": "DataSink",
    "name": "GenericRelplot",
    "label": "Relation Plot",
    "description": "Generic simple Relation plot",
    "license": "cc by-nc-nd 4.0",
    "version": "1.0.0",
    "dockerImage": "192.168.219.5:8098/enbic2lab/misc/generic_relplot:1.0.0",
    "tags": ["enbic2lab-misc", "cc by-nc-nd 4.0", "by-nc-nd", "Sink", "generic"],
    "parameters": [
      {
        "name": "--filepath",
        "label": "Filepath",
        "description": "Path to the CSV file",
        "defaultValue": "{{.inputs.input.path}}",
        "readOnly": true,
        "type": "string"
      },
      {
        "name": "--x-column",
        "label": "Column for X axis",
        "description": "Column name for the X axis",
        "type": "string"
      },
      {
        "name": "--y-column",
        "label": "Column for Y axis",
        "description": "Column name for the Y axis",
        "type": "string"
      },
      {
        "name": "--kind",
        "label": "Kind of plot",
        "description": "Kind of plot to generate",
        "defaultValue": "scatter",
        "type": "string",
        "choices": ["scatter", "line"]
      },
      {
        "name": "--palette",
        "label": "Palette",
        "description": "Color palette to use",
        "defaultValue": "tab10",
        "type": "string"
      },
      {
        "name": "--hue",
        "label": "Hue column",
        "description": "Column name for the hue",
        "defaultValue": null,
        "type": "string"
      },
      {
        "name": "--size",
        "label": "Size column",
        "description": "Column name for the size",
        "defaultValue": null,
        "type": "string"
      },
      {
        "name": "--style",
        "label": "Style column",
        "description": "Column name for the style",
        "defaultValue": null,
        "type": "string"
      },
      {
        "name": "--col",
        "label": "Subplot in columns column",
        "description": "Column name for the subplot in columns",
        "defaultValue": null,
        "type": "string"
      },
      {
        "name": "--row",
        "label": "Subplot in rows column",
        "description": "Column name for the subplot in rows",
        "defaultValue": null,
        "type": "string"
      },
      {
        "name": "--delimiter",
        "label": "Delimiter",
        "description": "Delimiter of the csv file",
        "defaultValue": ",",
        "type": "string"
      },
      {
        "name": "--output-path",
        "readOnly": true,
        "label": "Output path",
        "description": "Path to the output files",
        "defaultValue": "/mnt/shared",
        "type": "string"
      }
    ],
    "inputs": [
      {
        "name": "input",
        "type": "tabulardataset",
        "label": "Input CSV file",
        "path": "/mnt/shared/input.csv"
      }
    ],
    "outputs": [
      {
        "name": "output-pdf",
        "type": "pdf",
        "label": "Output PDF file",
        "path": "/mnt/shared/relplot.pdf"
      },
      {
        "name": "output-png",
        "type": "image",
        "label": "Output PNG image",
        "path": "/mnt/shared/relplot.png"
      },
      {
        "name": "output-svg",
        "type": "image",
        "label": "Output SVG image",
        "path": "/mnt/shared/relplot.svg"
      }
    ],
    "mainScriptPath": "main.py",
    "testPath": "test_main.py",
    "dependencies": [
      {
        "name": "python",
        "version": "3.11.5",
        "license": "PSF",
        "url": "https://www.python.org/"
      }
    ],
    "resources": {
      "cores": 1,
      "memory": 128,
      "gpuNeeded": false,
      "gpuMemory": null,
      "estimatedTimeInMin": 1
    },
    "publicationDate": "2023-11-23T14:30:00.000Z",
    "author": {
      "email": "khaos.research@gmail.com",
      "affiliation": "Khaos Research Group"
    },
    "contributor": [
      {
        "email": "juancaruru@uma.es",
        "affiliation": "Khaos Research Group"
      },
      {
        "email": "dandobjim@uma.es"
      }
    ]
  }
  