{
    "type": "DataSink",
    "name": "json2db",
    "label": "JSON2DB",
    "description": "Upload the json provided as input to a database",
    "license": "cc by-nc-nd 4.0",
    "version": "1.0.0",
    "dockerImage": "192.168.219.5:8098/enbic2lab/flora/json2db:1.0.0",
    "tags": [
        "enbic2lab",
        "flora",
        "samples",
        "taxons"
    ],
    "parameters": [
        {
            "name": "--filepath",
            "label": "Input JSON file",
            "description": "Input JSON file",
            "defaultValue": "{{.inputs.input.path}}",
            "readOnly": true,
            "type": "string"
        },
        {
            "name": "--collection-name",
            "label": "Collection name",
            "description": "Name of the collection in the database to which documents are to be uploaded. Options: floras_samples, floras_taxones",
            "type": "string",
            "choices": [
                "floras_samples",
                "floras_taxones"
            ]
        },
        {
            "name": "--collision-policy",
            "label": "Collision policy",
            "description": "Strategy to be used in case of database collision. Options: replace, ignore",
            "type": "string",
            "choices": [
                "replace",
                "ignore"
            ]
        }
    ],
    "inputs": [
        {
            "name": "input",
            "label": "Input JSON file",
            "path": "/mnt/shared/input.json",
            "type": "json"
        }
    ],
    "outputs": [],
    "mainScriptPath": "main.py",
    "testPath": "test_main.py",
    "dependencies": [
        {
            "name": "python",
            "version": "3.11.5",
            "license": "PSF",
            "url": "https://www.python.org/"
        }
    ],
    "resources": {
        "cores": 1,
        "memory": 128,
        "gpuNeeded": false,
        "gpuMemory": null,
        "estimatedTimeInMin": 4
    },
    "publicationDate": "2023-12-14T10:00:00.000Z",
    "author": {
        "email": "khaos.research@gmail.com",
        "affiliation": "Khaos Research Group"
    },
    "contributor": [
        {
            "email": "khaos.research@gmail.com",
            "affiliation": "Khaos Research Group"
        }
    ],
    "maintainer": [
        {
            "email": "khaos.research@gmail.com",
            "affiliation": "Khaos Research Group"
        }
    ]
}