{
  "type": "DataSink",
  "name": "sarimavisualization",
  "label": "Sarima visualization",
  "description": "Given the prediction array, pollen type and the start date for validation, returns the R2 visualisation",
  "license": "cc by-nc-nd 4.0",
  "version": "1.0.0",
  "dockerImage": "192.168.219.5:8098/enbic2lab/air/sarima_visualization:1.0.0",
  "tags": ["enbic2lab-air", "cc by-nc-nd 4.0", "by-nc-nd", "processing"],
  "parameters": [
    {
      "name": "--filepath",
      "label": "File path",
      "description": "Input CSV file path.",
      "defaultValue": "{{.inputs.input.path}}",
      "readOnly": true,
      "type": "string"
    }, 
    {
      "name": "--filepath-prediction",
      "label": "File path prediction",
      "description": "Input CSV file path.",
      "defaultValue": "{{.inputs.input2.path}}",
      "readOnly": true,
      "type": "string"
    },
    {
      "name": "--output",
      "label": "Output file path",
      "description": "Output file path",
      "defaultValue": "/mnt/shared/",
      "readOnly": true,
      "type": "string"
    },
    {
      "name": "--validation-time",
      "label": "Validation time",
      "description": "Validation time",
      "defaultValue": "2020-01-01",
      "type": "string"
    },
    {
      "name": "--date-column",
      "label": "Date column",
      "description": "Name of date column",
      "defaultValue": "fecha",
      "type": "string"
    },
    {
      "name": "--delimiter",
      "label": "Delimiter",
      "description": "Delimiter used in CSV.",
      "defaultValue":";",
      "type": "string"
    }
  ],
  "inputs": [
    {
      "name": "input",
      "label": "Input CSV file",
      "path": "/mnt/shared/Sarima_Y_test.csv",
      "type": "tabulardataset"
    },
    {
      "name": "input2",
      "label": "Input CSV file",
      "path": "/mnt/shared/Sarima_predictions.csv",
      "type": "tabulardataset"
    }
  ],
  "outputs": [
    {
      "name": "output",
      "label": "Output CSV file",
      "path": "/mnt/shared/Sarima_visualisation.png",
      "type": "image"
    }
  ],
  "mainScriptPath": "main.py",
  "testPath": "test_main.py",
  "dependencies": [
    {
      "name": "python",
      "version": "3.11.5",
      "license": "PSF",
      "url": "https://www.python.org/"
    }
  ],
  "resources": {
    "cores": 1,
    "memory": 128,
    "gpuNeeded": false,
    "gpuMemory": null,
    "estimatedTimeInMin": 4
  },
  "publicationDate": "2023-11-17T10:00:00.000Z",
  "author": {
    "email": "juansanchezrodriguez1999@uma.es",
    "affiliation": "Khaos Research Group"
  },
  "contributor": [
    {
      "email": "khaos.research@gmail.com"
    }
  ],
  "maintainer": [
    {
      "email": "khaos.research@gmail.com"
    }
  ]
}
