{
  "type": "DataAnalysing",
  "name": "etpstatistics",
  "label": "ETP Statistics",
  "description": "Calculates a series of statistic values from the output CSV file of the workflow ",
  "license": "cc by-nc-nd 4.0",
  "version": "1.0.1",
  "dockerImage": "192.168.219.5:8098/enbic2lab/water/etp_statistics_component:1.0.1",
  "tags": [
    "enbic2lab-water",
    "cc by-nc-nd 4.0",
    "by-nc-nd",
    "conversion"
  ],
  "parameters": [
    {
      "name": "--filepath",
      "label": "Filepath",
      "description": "Path to the csv file",
      "defaultValue": "{{.inputs.input.path}}",
      "readOnly": true,
      "type": "string"
    },
    {
      "name": "--output",
      "label": "Output path",
      "description": "Output path of the file",
      "defaultValue": "/mnt/shared/EtpStatistics.csv",
      "type": "string",
      "readOnly": true
    },
    {
      "name": "--delimiter",
      "label": "Delimiter",
      "description": "Delimiter of the csv file",
      "defaultValue": ";",
      "type": "string"
    },
    {
      "name": "--start-year",
      "label": "Start year",
      "defaultValue": 1997,
      "description": "Start year statistics",
      "type": "number"
    },
    {
      "name": "--end-year",
      "label": "End year",
      "defaultValue": 2023,
      "description": "End year statistics",
      "type": "number"
    },
    {
      "name": "--hydrological-year",
      "label": "Hydrological year",
      "description": "Hydrological year (True/False)",
      "defaultValue": "False",
      "type": "string"
    },
    {
      "name": "--variables-list",
      "label": "Variables list",
      "description": "List of variables separated with comma (,) to calculate",
      "defaultValue": "TMAX,TMIN,Latitud,TMedia,Distancia Tierra-Sol",
      "type": "string"
    },
    {
      "name": "--metrics-list",
      "label": "Metrics list",
      "description": "List of metrics separated with comma (,) to calculate",
      "defaultValue": "Max,Min,Mean,Median,Range",
      "type": "string"
    }
  ],
  "inputs": [
    {
      "name": "input",
      "label": "Input CSV file",
      "path": "/mnt/shared/etp_hargreaves_inf.csv",
      "type": "tabulardataset"
    }
  ],
  "outputs": [
    {
      "name": "output",
      "label": "Output CSV file",
      "path": "/mnt/shared/EtpStatistics.csv",
      "type": "tabulardataset"
    }
  ],
  "mainScriptPath": "main.py",
  "testPath": "test_main.py",
  "dependencies": [
    {
      "name": "python",
      "version": "3.11.5",
      "license": "PSF",
      "url": "https://www.python.org/"
    }
  ],
  "resources": {
    "cores": 1,
    "memory": 128,
    "gpuNeeded": false,
    "gpuMemory": null,
    "estimatedTimeInMin": 4
  },
  "publicationDate": "2023-11-15T10:00:00.000Z",
  "author": {
    "email": "juansanchezrodriguez1999@uma.es",
    "affiliation": "Khaos Research Group"
  },
  "contributor": [
    {
      "email": "khaos.research@gmail.com"
    }
  ],
  "maintainer": [
    {
      "email": "khaos.research@gmail.com"
    }
  ]
}