{
  "type": "DataSink",
  "name": "plot-trend",
  "label": "Plot Trend",
  "description": "calculates the main seasonal indexes of the pollen season (Start Date, Peak Date, End Date and Pollen Integral)",
  "license": "cc by-nc-nd 4.0",
  "version": "1.0.0",
  "dockerImage": "192.168.219.5:8098/enbic2lab/air/plot_trend:1.0.0",
  "tags": [
    "enbic2lab-air",
    "cc by-nc-nd 4.0", "by-nc-nd",
    "plot"
  ],
  "parameters": [
    {
      "name": "--filepath",
      "label": "Input Filepath",
      "description": "Input file path",
      "type": "string",
      "defaultValue": "{{.inputs.input.path}}",
      "readOnly": true
    },
    {
      "name": "--interpolation",
      "label": "Apply Interpolation",
      "description": "Apply interpolation to fill gaps",
      "type": "string",
      "defaultValue": "true"
    },
    {
      "name": "--intMethod",
      "label": "Interpolation Method",
      "description": "Interpolation method (lineal, movingmean, spline, tseries)",
      "type": "string",
      "defaultValue": "lineal"
    },
    {
      "name": "--method",
      "label": "Pollen Season Calculation Method",
      "description": "Method for calculating the pollen season",
      "type": "string",
      "defaultValue": "percentage"
    },
    {
      "name": "--delimiter",
      "label": "Dataframe Delimiter",
      "description": "Dataframe delimiter",
      "type": "string",
      "defaultValue": ","
    },
    {
      "name": "--output-folder",
      "label": "Output directory",
      "description": "Path to the output directory",
      "defaultValue": "/mnt/shared/",
      "readOnly": true,
      "type": "string"
    }
  ],
  "inputs": [
    {
      "name": "input",
      "label": "Input CSV file",
      "path": "/mnt/shared/input.csv",
      "type": "tabulardataset"
    }
  ],
  "outputs": [
    {
      "name": "output zip",
      "label": "Output ZIP file",
      "path": "/mnt/shared/output.zip",
      "type": "zip"
    },
    {
      "name": "output xlsx",
      "label": "Output XLSX file",
      "path": "/mnt/shared/output.xlsx",
      "type": "xlsx"
    }
  ],
  "mainScriptPath": "main.R",
  "testPath": "test_main.R",
  "dependencies": [
    {
      "name": "r",
      "version": "4.3.1",
      "license": "PSF",
      "url": "https://www.r-project.org/"
    }
  ],
  "resources": {
    "cores": 1,
    "memory": 128,
    "gpuNeeded": false,
    "gpuMemory": null,
    "estimatedTimeInMin": 4
  },
  "publicationDate": "2023-10-27T10:00:00.000Z",
  "author": {
    "email": "khaos.research@gmail.com",
    "affiliation": "Khaos Research Group"
  },
  "contributor": [
    {
      "email": "adrianseor.99@uma.es",
      "affiliation": "Khaos Research Group"
    }
  ]
}