{
    "type": "DataSink",
    "name": "CountNA",
    "label": "CountNA",
    "description": "Percentage calculation of NA in a dataset.",
    "license": "cc by-nc-nd 4.0",
    "version": "1.0.1",
    "dockerImage": "192.168.219.5:8098/enbic2lab/misc/countna:1.0.1",
    "tags": ["enbic2lab-misc", "cc by-nc-nd 4.0", "by-nc-nd", "sink"],
    "parameters": [
      {
        "name": "--filepath",
        "label": "Filepath",
        "description": "Path to the csv file",
        "defaultValue": "{{.inputs.input.path}}",
        "readOnly": true,
        "type": "string"
      },
      {
        "name": "--delimiter",
        "label": "Delimiter",
        "description": "Delimiter of the csv file",
        "defaultValue": ";",
        "type": "string"
      },
      {
        "name": "--output-path",
        "label": "Output path",
        "description": "Path to the output file",
        "defaultValue": "/mnt/shared",
        "readOnly": true,
        "type": "string"
      }
    ],
    "inputs": [
      {
        "name": "input",
        "type":"tabulardataset",
        "label": "Input CSV file",
        "path": "/mnt/shared/input.csv"
      }
    ],
    "outputs": [
      {
        "name": "output",
        "type": "pdf",
        "label": "Output PDF file",
        "path": "/mnt/shared/output.pdf"
      }
    ],
    "mainScriptPath": "main.py",
    "testPath": "test_main.py",
    "dependencies": [
      {
        "name": "python",
        "version": "3.11.5",
        "license": "PSF",
        "url": "https://www.python.org/"
      }
    ],
    "resources": {
      "cores": 1,
      "memory": 128,
      "gpuNeeded": false,
      "gpuMemory": null,
      "estimatedTimeInMin": 1
    },
    "publicationDate": "2023-10-31T11:30:00.000Z",
    "author": {
      "email": "khaos.research@gmail.com",
      "affiliation": "Khaos Research Group"
    },
    "contributor": [
      {
        "email": "juancaruru@uma.es",
        "affiliation": "Khaos Research Group"
      }
    ]
  }
  