{
  "type": "DataSink",
  "name": "plot-summary",
  "label": "Plot Summary",
  "description": "Plot pollen data during several seasons",
  "license": "cc by-nc-nd 4.0",
  "version": "1.0.0",
  "dockerImage": "192.168.219.5:8098/enbic2lab/air/plot_summary:1.0.0",
  "tags": [
    "enbic2lab-air",
    "cc by-nc-nd 4.0", "by-nc-nd",
    "summary"
  ],
  "parameters": [
    {
      "name": "--filepath",
      "label": "Input Filepath",
      "description": "Input file path",
      "type": "string",
      "defaultValue": "{{.inputs.input.path}}",
      "readOnly": true
    },
    {
      "name": "--pollen",
      "label": "Particle Name",
      "description": "Particle name (mandatory)",
      "type": "string"
    },
    {
      "name": "--mave",
      "label": "Order of the Moving Average",
      "description": "Order of the moving average (default: 1)",
      "type": "number",
      "defaultValue": 1
    },
    {
      "name": "--normalized",
      "label": "Use Normalized Data",
      "description": "Use normalized data (default: TRUE)",
      "type": "string",
      "defaultValue": "true"
    },
    {
      "name": "--interpolation",
      "label": "Apply Interpolation",
      "description": "Apply interpolation (default: TRUE)",
      "type": "string",
      "defaultValue": "true"
    },
    {
      "name": "--intMethod",
      "label": "Interpolation Method",
      "description": "Interpolation method",
      "type": "string",
      "defaultValue": "lineal"
    },
    {
      "name": "--axisname",
      "label": "Y-axis Title",
      "description": "Y-axis title (default: 'Pollen grains / m3')",
      "type": "string",
      "defaultValue": "Pollen grains / m3"
    },
    {
      "name": "--delimiter",
      "label": "Dataframe Delimiter",
      "description": "Dataframe delimiter",
      "type": "string",
      "defaultValue": ","
    },
    {
      "name": "--output-folder",
      "label": "Output directory",
      "description": "Path to the output directory",
      "defaultValue": "/mnt/shared/",
      "readOnly": true,
      "type": "string"
    }
  ],
  "inputs": [
    {
      "name": "input",
      "label": "Input CSV file",
      "path": "/mnt/shared/input.csv",
      "type": "tabulardataset"
    }
  ],
  "outputs": [
    {
      "name": "output pdf",
      "label": "Output PDF file",
      "path": "/mnt/shared/output.pdf",
      "type": "pdf"
    }
  ],
  "mainScriptPath": "main.R",
  "testPath": "test_main.R",
  "dependencies": [
    {
      "name": "r",
      "version": "4.3.1",
      "license": "PSF",
      "url": "https://www.r-project.org/"
    }
  ],
  "resources": {
    "cores": 1,
    "memory": 128,
    "gpuNeeded": false,
    "gpuMemory": null,
    "estimatedTimeInMin": 4
  },
  "publicationDate": "2023-11-03T10:00:00.000Z",
  "author": {
    "email": "khaos.research@gmail.com",
    "affiliation": "Khaos Research Group"
  },
  "contributor": [
    {
      "email": "adrianseor.99@uma.es",
      "affiliation": "Khaos Research Group"
    }
  ]
}